<?xml version="1.0" encoding="UTF-8"?>
<paises xmlns:xsi="http://www.w3.org/2001/XMLSchema-instance" xsi:noNamespaceSchemaLocation="file:///E:/Marcas/Git/XML-Esquemas/ejercicio%201_1/1_1_5sch.xsd">
  <pais>
    <nombre>España</nombre>
    <unionEuropea/>
    <otan/>
  </pais>
  <pais>
    <nombre>Noruega</nombre>
    <otan/>
  </pais>
  <pais>
    <nombre>Austria</nombre>
    <unionEuropea/>
  </pais>
  <pais>
    <nombre>Brasil</nombre>
  </pais>
</paises>
